<?xml version="1.0" encoding="UTF-8"?>
<!DOCTYPE list SYSTEM "item.dtd">
<list>
	<armor id="37533" name="NC Messenger\'s Hat">
		<set name="sellable" value="false" />
		<set name="privatestoreable" value="false" />
		<set name="dropable" value="false" />
		<set name="tradeable" value="false" />
		<set name="crystal_type" value="NONE" />
		<set name="icon" value="icon.nc_hair_acc" />
		<set name="price" value="0" />
		<set name="type" value="NONE" />
		<equip>
			<slot id="HAIR_ALL" />
		</equip>
	</armor>
	<armor id="37534" name="Santa Suit">
		<set name="sellable" value="false" />
		<set name="privatestoreable" value="false" />
		<set name="dropable" value="false" />
		<set name="tradeable" value="false" />
		<set name="crystal_type" value="NONE" />
		<set name="icon" value="icon.armor_ev_santas_clothes" />
		<set name="price" value="0" />
		<set name="type" value="HEAVY" />
		<equip>
			<slot id="FORMAL_WEAR" />
			<visual>
                <change slot="FORMAL_WEAR" to_id="37534"/>
			</visual>
		</equip>
	</armor>
	<armor id="37535" name="Santa Hat">
		<set name="sellable" value="false" />
		<set name="privatestoreable" value="false" />
		<set name="dropable" value="false" />
		<set name="tradeable" value="false" />
		<set name="crystal_type" value="NONE" />
		<set name="icon" value="icon.accessory_santas_cap_i00" />
		<set name="price" value="0" />
		<set name="type" value="NONE" />
		<equip>
			<slot id="HAIR_ALL" />
		</equip>
	</armor>
	<etcitem id="37543" name="Snowy Squash Nectar">
		<set name="sellable" value="false" />
		<set name="icon" value="icon.etc_nectar_i01" />
		<set name="stackable" value="true" />
		<set name="crystal_type" value="NONE" />
	</etcitem>
	<etcitem id="37544" name="Snowball">
		<set name="sellable" value="false" />
		<set name="icon" value="BranchSys2.icon.g_illumination_white" />
		<set name="stackable" value="true" />
		<set name="crystal_type" value="NONE" />
	</etcitem>
	<etcitem id="37545" name="Large Snowball">
		<set name="sellable" value="false" />
		<set name="icon" value="BranchSys2.icon.g_illumination_white" />
		<set name="stackable" value="true" />
		<set name="crystal_type" value="NONE" />
	</etcitem>
	<etcitem id="37546" name="Rudolf\'s Gift 2015" add_name="Lv. 1">
		<set name="icon" value="icon.etc_pi_gift_box_i04" />
		<set name="weight" value="10" />
		<set name="stackable" value="true" />
		<set name="crystal_type" value="NONE" />
	</etcitem>
	<etcitem id="37547" name="Rudolf\'s Gift 2015" add_name="Lv. 2">
		<set name="icon" value="icon.etc_pi_gift_box_i04" />
		<set name="weight" value="10" />
		<set name="stackable" value="true" />
		<set name="crystal_type" value="NONE" />
	</etcitem>
	<etcitem id="37548" name="Rudolf\'s Gift 2015" add_name="Lv. 3">
		<set name="icon" value="icon.etc_pi_gift_box_i04" />
		<set name="weight" value="10" />
		<set name="stackable" value="true" />
		<set name="crystal_type" value="NONE" />
	</etcitem>
	<etcitem id="37549" name="Rudolf\'s Gift 2015" add_name="Lv. 4">
		<set name="icon" value="icon.etc_pi_gift_box_i04" />
		<set name="weight" value="10" />
		<set name="stackable" value="true" />
		<set name="crystal_type" value="NONE" />
	</etcitem>
	<etcitem id="37550" name="Snowman\'s Buff">
		<set name="icon" value="icon.weapon_snowman_stick_i00" />
		<set name="weight" value="120" />
		<set name="stackable" value="true" />
		<set name="crystal_type" value="NONE" />
	</etcitem>
	<etcitem id="37551" name="Christmas Present">
		<set name="sellable" value="false" />
		<set name="icon" value="icon.etc_pi_gift_box_i04" />
		<set name="stackable" value="true" />
		<set name="crystal_type" value="NONE" />
	</etcitem>
	<etcitem id="37552" name="Snowy Squash Seed">
		<set name="icon" value="icon.etc_gourd_i10" />
		<set name="stackable" value="true" />
		<set name="crystal_type" value="NONE" />
	</etcitem>
	<etcitem id="37553" name="Large Snowy Squash Seed">
		<set name="icon" value="icon.etc_gourd_i11" />
		<set name="stackable" value="true" />
		<set name="crystal_type" value="NONE" />
	</etcitem>
</list>