<?xml version="1.0" encoding="UTF-8"?>
<!DOCTYPE list SYSTEM "item.dtd">
<list>
	<etcitem id="6571" name="Blessed Scroll: Enchant Weapon (B-grade)" add_name="Not in Use">
		<set name="type" value="SCROLL_ENCHANT_WEAPON"/>
		<set name="crystal_type" value="NONE"/>
		<set name="icon" value="icon.etc_blessed_scrl_of_ench_wp_b_i03"/>
		<set name="price" value="7000000"/>
		<set name="stackable" value="true"/>
		<set name="weight" value="120"/>
	</etcitem>
	<etcitem id="6572" name="Blessed Scroll: Enchant Armor (B-grade)" add_name="Not in Use">
		<set name="type" value="SCROLL_ENCHANT_ARMOR"/>
		<set name="crystal_type" value="NONE"/>
		<set name="icon" value="icon.etc_blessed_scrl_of_ench_am_b_i03"/>
		<set name="price" value="750000"/>
		<set name="stackable" value="true"/>
		<set name="weight" value="120"/>
	</etcitem>
	<etcitem id="6573" name="Blessed Scroll: Enchant Weapon (C-grade)" add_name="Not in Use">
		<set name="type" value="SCROLL_ENCHANT_WEAPON"/>
		<set name="crystal_type" value="NONE"/>
		<set name="icon" value="icon.etc_blessed_scrl_of_ench_wp_c_i02"/>
		<set name="price" value="3000000"/>
		<set name="stackable" value="true"/>
		<set name="weight" value="120"/>
	</etcitem>
	<etcitem id="6574" name="Blessed Scroll: Enchant Armor (C-grade)" add_name="Not in Use">
		<set name="type" value="SCROLL_ENCHANT_ARMOR"/>
		<set name="crystal_type" value="NONE"/>
		<set name="icon" value="icon.etc_blessed_scrl_of_ench_am_c_i02"/>
		<set name="price" value="350000"/>
		<set name="stackable" value="true"/>
		<set name="weight" value="120"/>
	</etcitem>
	<etcitem id="6575" name="Blessed Scroll: Enchant Weapon (D-grade)" add_name="Not in Use">
		<set name="type" value="SCROLL_ENCHANT_WEAPON"/>
		<set name="crystal_type" value="NONE"/>
		<set name="icon" value="icon.etc_blessed_scrl_of_ench_wp_d_i01"/>
		<set name="price" value="900000"/>
		<set name="stackable" value="true"/>
		<set name="weight" value="120"/>
	</etcitem>
	<etcitem id="6576" name="Blessed Scroll: Enchant Armor (D-grade)" add_name="Not in Use">
		<set name="type" value="SCROLL_ENCHANT_ARMOR"/>
		<set name="crystal_type" value="NONE"/>
		<set name="icon" value="icon.etc_blessed_scrl_of_ench_am_d_i01"/>
		<set name="price" value="100000"/>
		<set name="stackable" value="true"/>
		<set name="weight" value="120"/>
	</etcitem>
</list>